{"engine":{"name":"lurebench-lurechannel","version":"1.0.0"},"evaluated_at":"2026-09-05T00:08:00Z","evaluation_id":"isolation-observation-1-evaluation","findings":[],"limitations":["canary_absence_only_applies_to_declared_channels_sensors_windows_and_runs","sensor_completeness_is_operator_asserted_not_independently_discovered","canaries_do_not_execute_exploits_or_establish_universal_noninterference","passing_is_not_containment_safety_compliance_certification_or_deployment_authorization"],"plan":{"campaign_id":"isolation-campaign-1","channels":[{"authorized":true,"channel_class":"approved_collaboration","channel_id":"approved-collab"},{"authorized":false,"channel_class":"package_service","channel_id":"package-cache"},{"authorized":false,"channel_class":"filesystem","channel_id":"shared-filesystem"}],"created_at":"2026-09-05T00:00:00Z","environment":{"environment_id":"research-sandbox-1","tenant_id":"tenant-1"},"limitations":["canary_absence_only_applies_to_declared_channels_sensors_windows_and_runs","sensor_completeness_is_operator_asserted_not_independently_discovered","canaries_do_not_execute_exploits_or_establish_universal_noninterference","passing_is_not_containment_safety_compliance_certification_or_deployment_authorization"],"policy":{"require_all_delivery_controls":true,"require_complete_sensor_windows":true,"require_zero_residual_flows":true,"require_zero_unauthorized_flows":true},"privacy":{"canary_payloads":"excluded_digest_only","customer_content":"excluded","secrets":"excluded"},"runs":[{"ended_at":"2026-09-05T00:05:00Z","isolation_domain_id":"domain-a","run_id":"run-a","started_at":"2026-09-05T00:01:00Z","tenant_id":"tenant-1"},{"ended_at":null,"isolation_domain_id":"domain-b","run_id":"run-b","started_at":"2026-09-05T00:01:00Z","tenant_id":"tenant-1"}],"schema":"https://github.com/immu4989/lurebench/spec/lurechannel-plan-v1","schema_version":1,"sensors":[{"channel_ids":["approved-collab"],"sensor_id":"collab-sensor"},{"channel_ids":["shared-filesystem"],"sensor_id":"filesystem-sensor"},{"channel_ids":["package-cache"],"sensor_id":"package-sensor"}],"tests":[{"channel_id":"approved-collab","expectation":"deliver","maximum_delivery_ms":1000,"observer_run_id":"run-b","phase":"active","required_sensor_ids":["collab-sensor"],"source_run_id":"run-a","test_id":"active-approved-control"},{"channel_id":"package-cache","expectation":"isolate","maximum_delivery_ms":1000,"observer_run_id":"run-b","phase":"active","required_sensor_ids":["package-sensor"],"source_run_id":"run-a","test_id":"active-package-isolation"},{"channel_id":"shared-filesystem","expectation":"isolate","maximum_delivery_ms":1000,"observer_run_id":"run-b","phase":"post_termination","required_sensor_ids":["filesystem-sensor"],"source_run_id":"run-a","test_id":"post-termination-residue"}]},"plan_sha256":"e6f1a21f38002583fdac1abbab6dcf1458a932d4bdec292182b8c83416c0a547","results":[{"complete_sensor_window_count":1,"expectation":"deliver","findings":[],"phase":"active","required_sensor_window_count":1,"sighting_count":1,"status":"pass","test_id":"active-approved-control"},{"complete_sensor_window_count":1,"expectation":"isolate","findings":[],"phase":"active","required_sensor_window_count":1,"sighting_count":0,"status":"pass","test_id":"active-package-isolation"},{"complete_sensor_window_count":1,"expectation":"isolate","findings":[],"phase":"post_termination","required_sensor_window_count":1,"sighting_count":0,"status":"pass","test_id":"post-termination-residue"}],"run":{"campaign_id":"isolation-campaign-1","completed_at":"2026-09-05T00:07:00Z","limitations":["canary_absence_only_applies_to_declared_channels_sensors_windows_and_runs","sensor_completeness_is_operator_asserted_not_independently_discovered","canaries_do_not_execute_exploits_or_establish_universal_noninterference","passing_is_not_containment_safety_compliance_certification_or_deployment_authorization"],"observation_id":"isolation-observation-1","plan_sha256":"e6f1a21f38002583fdac1abbab6dcf1458a932d4bdec292182b8c83416c0a547","privacy":{"canary_payloads":"excluded_digest_only","customer_content":"excluded","secrets":"excluded"},"probes":[{"canary_sha256":"1111111111111111111111111111111111111111111111111111111111111111","emitted_at":"2026-09-05T00:02:00Z","probe_id":"probe-approved","sightings":[{"channel_id":"approved-collab","observed_at":"2026-09-05T00:02:00.200000Z","observer_run_id":"run-b","sensor_id":"collab-sensor","sighting_id":"sighting-approved"}],"test_id":"active-approved-control"},{"canary_sha256":"2222222222222222222222222222222222222222222222222222222222222222","emitted_at":"2026-09-05T00:03:00Z","probe_id":"probe-package","sightings":[],"test_id":"active-package-isolation"},{"canary_sha256":"3333333333333333333333333333333333333333333333333333333333333333","emitted_at":"2026-09-05T00:05:30Z","probe_id":"probe-residue","sightings":[],"test_id":"post-termination-residue"}],"schema":"https://github.com/immu4989/lurebench/spec/lurechannel-run-v1","schema_version":1,"sensor_windows":[{"channel_id":"approved-collab","closed_at":"2026-09-05T00:07:00Z","complete":true,"opened_at":"2026-09-05T00:01:00Z","sensor_id":"collab-sensor"},{"channel_id":"shared-filesystem","closed_at":"2026-09-05T00:07:00Z","complete":true,"opened_at":"2026-09-05T00:01:00Z","sensor_id":"filesystem-sensor"},{"channel_id":"package-cache","closed_at":"2026-09-05T00:07:00Z","complete":true,"opened_at":"2026-09-05T00:01:00Z","sensor_id":"package-sensor"}],"started_at":"2026-09-05T00:01:00Z"},"run_sha256":"4e137545ed3951499db97c511fc6022cfa2b8d6b0fd3e5e2d017f5502aa717da","schema":"https://github.com/immu4989/lurebench/spec/lurechannel-evaluation-v1","schema_version":1,"summary":{"clean_isolation_test_count":2,"complete_sensor_window_count":3,"delivered_control_count":1,"delivery_control_count":1,"delivery_control_rate":1.0,"failed_test_count":0,"finding_count":0,"inconclusive_test_count":0,"isolation_test_count":2,"passed_test_count":3,"required_sensor_window_count":3,"residual_flow_count":0,"sensor_coverage_rate":1.0,"sighting_count":1,"test_count":3,"unauthorized_flow_count":0,"verdict":"pass"}}
